{
  "$schema": "http://json-schema.org/draft-07/schema#",
  "title": "Dictionary Colouring",
  "type": "object",
  "required": [
    "concept",
    "type",
    "viewBox",
    "shapes"
  ],
  "additionalProperties": false,
  "properties": {
    "concept": {
      "type": "string"
    },
    "type": {
      "type": "string",
      "const": "colouring"
    },
    "viewBox": {
      "type": "string",
      "pattern": "^[\\d.]+ [\\d.]+ [\\d.]+ [\\d.]+$"
    },
    "shapes": {
      "type": "array",
      "minItems": 1,
      "items": {
        "type": "object",
        "required": [
          "id",
          "tag",
          "attrs"
        ],
        "additionalProperties": false,
        "properties": {
          "id": {
            "type": "string"
          },
          "tag": {
            "type": "string",
            "enum": [
              "path",
              "ellipse",
              "circle",
              "rect",
              "polygon",
              "polyline",
              "line"
            ]
          },
          "attrs": {
            "type": "object",
            "additionalProperties": {
              "type": "string"
            }
          },
          "colour": {
            "type": [
              "string",
              "null"
            ],
            "pattern": "^#[0-9A-Fa-f]{6}$"
          },
          "noColour": {
            "type": "boolean"
          },
          "fixed": {
            "type": "boolean"
          }
        }
      }
    }
  }
}
