{
  "concept": "orange",
  "type": "colouring",
  "viewBox": "0 0 658.609376 549",
  "shapes": [
    {
      "id": "shape_1",
      "tag": "path",
      "attrs": {
        "d": "M 183.726563 167.140625 C 0 285.910156 84.648438 549 313.089844 535.808594 C 356.148438 533.320312 399.519532 513.75 433.1875 485.46875 C 658.609376 296.160156 420.507813 0 183.726563 167.140625",
        "stroke-width": "2"
      },
      "colour": "#FF8827"
    },
    {
      "id": "shape_2",
      "tag": "path",
      "attrs": {
        "d": "M 212.738282 200.769531 C 212.546876 201.046875 205.636719 193.878906 205 193.308594 C 199.476563 188.308594 193.6875 183.546875 188 178.707031 C 180.160157 172.027344 172.796876 165.597656 163.457032 160.539062 C 159.578126 158.429688 151.320313 156.828125 149.578126 152.6875 C 147.007813 146.578125 151.777344 136.347656 154.386719 130.828125 C 156.257813 126.898438 158.707032 120.9375 163.070313 118.609375 C 170.867188 114.449219 181.160157 128.308594 184.667969 132.367188 C 188.347657 136.628906 192.058594 140.847656 195.910157 144.980469 C 205.75 155.539062 246.417969 179.679688 212.738282 200.769531",
        "stroke-width": "2"
      },
      "colour": "#668E1B"
    },
    {
      "id": "shape_3",
      "tag": "path",
      "attrs": {
        "d": "M 157.199219 148.179688 C 152.007813 146.039062 160.488282 123.917969 169.136719 123.769531 C 175.796876 123.640625 166.96875 152.207031 157.199219 148.179688",
        "stroke-width": "2",
        "fill": "#BECB83"
      },
      "noColour": true,
      "fixed": true
    },
    {
      "id": "shape_4",
      "tag": "path",
      "attrs": {
        "d": "M 215.5 189.378906 C 215.257813 189.398438 215.488282 176.019531 217.957032 166.21875 C 223.839844 142.910156 233.859376 120.390625 246.628907 100.597656 C 284.976563 41.140625 356.367188 25.507812 417.847657 48.769531 C 433.179688 54.570312 447.238282 62.339844 459.757813 73.628906 C 461.9375 75.589844 470.046876 80.808594 470.660157 84.089844 C 470.757813 84.648438 468.589844 83.949219 468.578126 83.949219 C 465.519532 83.160156 462.429688 82.539062 459.328126 81.9375 C 452.410157 80.609375 445.429688 79.488281 438.417969 78.839844 C 416.617188 76.808594 393.820313 79.589844 372.378907 83.847656 C 311.257813 96 255.207032 134.707031 220.417969 190.25",
        "stroke-width": "2"
      },
      "colour": "#BECB83"
    },
    {
      "id": "shape_5",
      "tag": "path",
      "attrs": {
        "d": "M 213.179688 200.777344 C 217.976563 185.320312 232.929688 169.867188 242.949219 158.539062 C 276.636719 120.449219 318.777344 92.878906 367 82.75 C 393.386719 77.207031 420.9375 74.289062 447.71875 78.1875 C 450.558594 78.597656 468.660157 79.9375 469.648438 84.238281 C 469.828126 85 455.367188 90.179688 454.347657 90.617188 C 435.648438 98.609375 417.886719 109.769531 399.367188 118.359375 C 382.570313 126.160156 365.519532 132.648438 347.929688 138.027344 C 310.289063 149.558594 245.808594 175.570312 213.179688 200.777344",
        "stroke-width": "2"
      },
      "colour": "#668E1B"
    },
    {
      "id": "shape_6",
      "tag": "path",
      "attrs": {
        "d": "M 122.109376 360.027344 C 110.9375 343.589844 117.109376 297.75 119.929688 290.179688 C 130 263.140625 146.648438 227.238281 180.429688 225.328125 C 193.019532 224.617188 206.289063 225.480469 218.007813 220.097656 C 247.558594 206.539062 272.878907 168.71875 301.878907 206.71875 C 376.078126 303.949219 175.519532 438.640625 122.109376 360.027344",
        "stroke-width": "2"
      },
      "colour": "#FFD889"
    },
    {
      "id": "shape_7",
      "tag": "path",
      "attrs": {
        "d": "M 241.257813 487.929688 C 248.488282 491.71875 316.738282 474.578125 324.257813 471.867188 C 403.898438 443.230469 436.296876 385.738281 441.726563 302.558594 C 442.988282 283.21875 438.257813 263.238281 440.917969 244.117188 C 443.410157 226.148438 457.160157 225.738281 469.726563 235.910156 C 503.097657 262.9375 503.207032 319.25 492.21875 356.539062 C 468.570313 436.777344 412.097657 502.539062 331.660157 515.179688 C 316.617188 517.539062 258.9375 511.628906 241.257813 487.929688",
        "stroke-width": "2"
      },
      "colour": "#CB5C0D"
    }
  ]
}
