{
  "concept": "first-aid",
  "type": "colouring",
  "viewBox": "0 0 372.3 354.8",
  "shapes": [
    {
      "id": "shape_11",
      "tag": "path",
      "attrs": {
        "d": "M 290.8 27.6 v 88.2 h -43.7 v -72.8 h -131 v 72.8 h -43.7 V 27.6 c 0 -15.2 12.3 -27.6 27.6 -27.6 h 163.2 C 278.5 0 290.8 12.3 290.8 27.6 z",
        "stroke-width": "2"
      },
      "colour": "#FFFFFF"
    },
    {
      "id": "shape_12",
      "tag": "path",
      "attrs": {
        "d": "M 38 342.8 c -18.8 0 -34 -15.3 -34 -34 v -198 c 0 -18.8 15.3 -34 34 -34 h 287.3 c 18.8 0 34 15.3 34 34 v 198 c 0 18.8 -15.3 34 -34 34 H 38 z",
        "stroke-width": "2"
      },
      "colour": "#FFFFFF"
    },
    {
      "id": "shape_13",
      "tag": "path",
      "attrs": {
        "d": "M 325.3 80.8 c 16.6 0 30 13.4 30 30 v 198 c 0 16.6 -13.4 30 -30 30 H 38 c -16.6 0 -30 -13.4 -30 -30 v -198 c 0 -16.6 13.4 -30 30 -30 H 325.3 M 325.3 72.8 H 38 c -21 0 -38 17.1 -38 38 v 198 c 0 21 17.1 38 38 38 h 287.3 c 21 0 38 -17.1 38 -38 v -198 C 363.3 89.8 346.3 72.8 325.3 72.8 L 325.3 72.8 z",
        "stroke-width": "2"
      },
      "colour": "#6D0F05"
    },
    {
      "id": "shape_14",
      "tag": "line",
      "attrs": {
        "x1": "8.000000000000007",
        "y1": "229.60000000000002",
        "x2": "355.29999999999995",
        "y2": "229.60000000000002",
        "stroke-width": "2"
      },
      "noColour": true,
      "colour": null
    },
    {
      "id": "shape_15",
      "tag": "rect",
      "attrs": {
        "x": "72.5",
        "y": "198.80000000000007",
        "width": "24.3",
        "height": "61.7",
        "stroke-width": "2"
      },
      "colour": "#FF1E46"
    },
    {
      "id": "shape_16",
      "tag": "rect",
      "attrs": {
        "x": "270.29999999999995",
        "y": "198.80000000000007",
        "width": "24.3",
        "height": "61.7",
        "stroke-width": "2"
      },
      "colour": "#FF1E46"
    },
    {
      "id": "shape_17",
      "tag": "rect",
      "attrs": {
        "x": "160.70000000000002",
        "y": "106.80000000000007",
        "width": "41.9",
        "height": "100.3",
        "stroke-width": "2"
      },
      "colour": "#FF1E46"
    },
    {
      "id": "shape_18",
      "tag": "rect",
      "attrs": {
        "x": "131.5",
        "y": "136",
        "width": "100.3",
        "height": "41.9",
        "stroke-width": "2"
      },
      "colour": "#FF1E46"
    },
    {
      "id": "shape_19",
      "tag": "path",
      "attrs": {
        "d": "M 341.7 98.6 c 0 -1.2 -0.5 -2.4 -1.3 -3.2 c -0.8 -0.8 -2.1 -1.4 -3.2 -1.3 c -1.2 0.1 -2.4 0.4 -3.2 1.3 c -0.8 0.9 -1.4 2 -1.3 3.2 c 0 1 0.3 1.9 0.9 2.7 c 0 0.1 0.1 0.2 0.1 0.3 c 0.4 0.6 0.8 1.1 1.5 1.5 c 0.6 0.4 1.3 0.6 2.1 0.6 c 0.7 0 1.4 -0.2 2.1 -0.6 c 0.6 -0.4 1.1 -0.8 1.5 -1.5 c 0 0 0 -0.1 0.1 -0.1 C 341.3 100.7 341.7 99.5 341.7 98.6 z",
        "stroke-width": "2"
      },
      "colour": "#6D0F05"
    },
    {
      "id": "shape_20",
      "tag": "path",
      "attrs": {
        "d": "M 24.4 98.1 c -6.1 0 -6.1 9.5 0 9.5 C 30.5 107.6 30.5 98.1 24.4 98.1 z",
        "stroke-width": "2"
      },
      "colour": "#6D0F05"
    }
  ]
}
