{
  "concept": "banana",
  "type": "colouring",
  "viewBox": "0 0 490.257812 545.6875",
  "shapes": [
    {
      "id": "shape_1",
      "tag": "path",
      "attrs": {
        "d": "M 130.867187 256.449219 C 128.21875 254.839844 125.890625 242.648438 125.609375 240.078126 C 123.738281 223.417969 123.039062 206.617188 121.457031 189.917969 C 120.277344 177.488282 119.410156 165.027344 118.558594 152.570313 C 115.800781 112.070313 113.648437 2.289063 175.910156 0.839844 C 212.347656 0 218.367187 35.417969 215.820312 63.617188 C 213.238281 92.199219 218.980468 119.71875 226.488281 146.558594 C 228.558594 153.988282 235.550781 173.457032 237.117187 179.726563 C 240.75 194.308594 246.257812 205.078126 244.21875 220.167969 C 242.75 231.078126 230.25 242.25 225.71875 252.289063 C 222.527344 259.347657 223.289062 270.117188 219.539062 276.296876 C 218.777344 277.539063 216.507812 276.007813 215.71875 275.519532 C 204.6875 268.609376 197 256.789063 185.929687 249.320313 C 168.917968 237.820313 148.160156 249.886719 130.867187 256.449219",
        "stroke-width": "2"
      },
      "colour": "#F3DFC4"
    },
    {
      "id": "shape_2",
      "tag": "path",
      "attrs": {
        "d": "M 179.9375 242.898438 C 180.308594 242.738282 170.328125 219.738282 169.457031 217.808594 C 161.320312 199.867188 157.160156 184.957032 152.398437 168.089844 C 140.660156 126.519532 145.449218 86.078126 158.488281 45.75 C 162.609375 33 170.800781 11.589844 186.71875 11.25 C 206.6875 10.839844 202.820312 49.859376 202.539062 62.058594 C 202.140625 79.457032 201.839844 88.886719 202.789062 106.277344 C 203.378906 117.007813 209.679687 150.707032 213.449218 160.777344 C 220.558594 179.726563 233.25 201.398438 228.847656 205.796876 C 225.300781 209.347657 217.929687 221.957032 215.527344 227.757813 C 213.828125 231.847657 211.109375 248.789063 205.96875 249.679688 C 200.089844 250.707032 185.4375 244.867188 179.9375 242.898438",
        "stroke-width": "2"
      },
      "colour": "#F9EBD7"
    },
    {
      "id": "shape_3",
      "tag": "path",
      "attrs": {
        "d": "M 211.007812 261.199219 C 212.097656 224.046876 245.140625 194.269532 282.378906 199.226563 C 286.039062 199.71875 289.730468 204.199219 293.300781 205.609376 C 324.820312 218.007813 356.097656 229.757813 380.640625 254.257813 C 394 267.597657 404.820312 283.386719 416.410156 298.207032 C 426.949218 311.6875 453.539062 305.519532 466.800781 315.976563 C 469.390625 318.019532 458.578125 330.148438 456.488281 334.589844 C 454.128906 339.617188 442.828125 339.367188 435 334.589844 C 421.96875 326.636719 406.867187 309.929688 393.539062 295.839844 C 366.390625 267.148438 349.75 237.449219 310.597656 225.21875 C 292.410156 219.527344 268.359375 221.578126 269.25 245.277344 C 271.199218 297.417969 335.9375 360.429688 380.667968 380.546876 C 404.707031 391.359376 430.289062 389.667969 454.757812 397.589844 C 460.480468 399.4375 469.667968 410.628907 465.9375 417.117188 C 462.988281 422.238282 449.808594 422.597657 444.917968 422.9375 C 423.140625 424.449219 396.699218 428.136719 375.769531 423.199219 C 305.5 406.628907 258.46875 370.476563 219.800781 308.628907 C 210.167968 293.226563 192.320312 281.398438 179.378906 268.589844 C 175.859375 265.109376 167.707031 254.6875 168.230468 250.328126 C 170.46875 231.859376 207.628906 261.527344 211.007812 261.199219",
        "stroke-width": "2"
      },
      "colour": "#FEDE4E"
    },
    {
      "id": "shape_4",
      "tag": "path",
      "attrs": {
        "d": "M 164.050781 249.527344 C 163.640625 249.628907 164.117187 249.796876 164.300781 249.867188 C 167.769531 251.339844 170.957031 254.597657 173.769531 257.007813 C 180.308594 262.617188 186.339844 268.917969 192.5 274.9375 C 210.5 292.539063 225.519531 312.007813 240.488281 332.160157 C 276.457031 380.527344 328.367187 412.578126 388.640625 420.578126 C 397.328125 421.726563 406.007812 422.457032 414.757812 423 C 420.019531 423.320313 425.21875 423.257813 430.457031 422.667969 C 450.980468 420.359376 467.570312 406.867188 478.679687 426.738282 C 481.839844 432.386719 482.199218 436.617188 478.789062 442.398438 C 454.769531 483.238282 391.199218 491.386719 349.019531 487.1875 C 280.347656 480.339844 228.6875 453.410157 183.539062 401.007813 C 174.300781 390.277344 159.230468 379.386719 154.230468 365.910157 C 147.570312 347.957032 150.570312 336.46875 151.71875 317.820313 C 152.808594 299.976563 154.867187 265.167969 164.050781 249.527344",
        "stroke-width": "2"
      },
      "colour": "#EFC90E"
    },
    {
      "id": "shape_5",
      "tag": "path",
      "attrs": {
        "d": "M 473.488281 422.070313 C 467.46875 420.839844 450.597656 405.46875 458.609375 399.949219 C 479.207031 385.75 490.257812 436.660157 471.820312 419.6875",
        "stroke-width": "2",
        "fill": "#795548"
      },
      "colour": "#93722B"
    },
    {
      "id": "shape_6",
      "tag": "path",
      "attrs": {
        "d": "M 179.378906 245.019532 C 162.5 250.667969 156.589844 286.976563 153.820312 301.25 C 142.769531 358.070313 165.640625 415.976563 160.5 473.269532 C 158.9375 490.699219 152.398437 545.6875 125.820312 541.207032 C 98.9375 536.667969 77.207031 496.046876 65.070312 475.296876 C 42.988281 437.558594 0 349.1875 28.71875 306.539063 C 51.507812 272.679688 105.398437 262.136719 141.648437 249.796876 C 145.410156 248.519532 177.558594 237.757813 179.378906 245.019532",
        "stroke-width": "2"
      },
      "colour": "#F3DFC4"
    },
    {
      "id": "shape_7",
      "tag": "path",
      "attrs": {
        "d": "M 244.550781 206.808594 C 243.589844 206.578126 251.519531 199.167969 251.988281 198.777344 C 256.777344 194.867188 261.757812 191.277344 266.878906 187.796876 C 284.9375 175.488282 305.457031 168.75 327.160156 174.976563 C 376.917968 189.269532 421.980468 229.699219 448.988281 272.578126 C 456.558594 284.597657 472.859375 314.609376 464.457031 329.296876 C 458.75 339.269532 447.457031 332.9375 440.308594 328.320313 C 419.808594 315.078126 404.117187 295.367188 387.550781 277.796876 C 335.367187 222.457032 316.140625 206.808594 244.550781 206.808594",
        "stroke-width": "2"
      },
      "colour": "#F3DFC4"
    }
  ]
}
