{
  "concept": "stethoscope",
  "type": "colouring",
  "viewBox": "0 0 340.4 361.4",
  "shapes": [
    {
      "id": "shape_10",
      "tag": "path",
      "attrs": {
        "d": "M 78.4 19.5 H 41.7 c 0 0 -41.7 171.9 87.2 178.2",
        "stroke-width": "2"
      },
      "noColour": true,
      "colour": null
    },
    {
      "id": "shape_11",
      "tag": "path",
      "attrs": {
        "d": "M 190.9 19.5 h 36.7 c 0 0 41.7 171.9 -87.2 178.2",
        "stroke-width": "2"
      },
      "noColour": true,
      "colour": null
    },
    {
      "id": "shape_12",
      "tag": "ellipse",
      "attrs": {
        "cx": "85.20000000000005",
        "cy": "19.5",
        "rx": "9.3",
        "ry": "19.5",
        "stroke-width": "2"
      },
      "colour": "#9B8579"
    },
    {
      "id": "shape_13",
      "tag": "ellipse",
      "attrs": {
        "cx": "187.10000000000014",
        "cy": "19.5",
        "rx": "9.3",
        "ry": "19.5",
        "stroke-width": "2"
      },
      "colour": "#9B8579"
    },
    {
      "id": "shape_14",
      "tag": "path",
      "attrs": {
        "d": "M 141.2 193.4 c -8.8 34 -11 69.7 -6.2 104.4 c 2 14.4 5.4 29.3 15.1 40.2 c 8.9 10 22.9 15.4 36.2 14 c 13.4 -1.4 25.9 -9.6 32.5 -21.2 c 6.8 -11.9 7.5 -26.5 5.7 -40.1 c -1.7 -13.6 -5.7 -26.9 -7.5 -40.5 c -1.8 -13.6 -1.2 -28.1 5.4 -40.1 s 20.7 -20.6 34.2 -17.6 c 12.2 2.7 21 14.3 24.1 26.4 c 3.1 12.1 1.6 24.9 0.1 37.4",
        "stroke-width": "2"
      },
      "noColour": true,
      "colour": null
    },
    {
      "id": "shape_15",
      "tag": "path",
      "attrs": {
        "d": "M 146.1 185 h -24.5 c -7.1 0 -12.9 5.8 -12.9 12.9 v 2.8 c 0 6.4 4.7 11.7 10.9 12.7 v 7.7 c 0 7.1 5.8 12.9 12.9 12.9 h 2.8 c 7.1 0 12.9 -5.8 12.9 -12.9 v -7.7 c 6.1 -1 10.9 -6.3 10.9 -12.7 v -2.8 C 158.9 190.8 153.1 185 146.1 185 z",
        "stroke-width": "2"
      },
      "colour": "#FF1E46"
    },
    {
      "id": "shape_16",
      "tag": "path",
      "attrs": {
        "d": "M 282.6 300.1 c -0.5 0 -1.1 -0.1 -1.5 -0.3 c -1.8 -0.7 -43.1 -18.5 -43.1 -51.1 c 0 -14.8 12 -26.8 26.8 -26.8 c 6.7 0 13 2.4 17.8 6.8 c 4.9 -4.4 11.2 -6.8 17.8 -6.8 c 14.8 0 26.8 12 26.8 26.8 c 0 31.4 -41.3 50.3 -43 51 C 283.7 300 283.1 300.1 282.6 300.1 z",
        "stroke-width": "2"
      },
      "colour": "#FF1E46"
    },
    {
      "id": "shape_17",
      "tag": "path",
      "attrs": {
        "d": "M 300.4 225.9 c 12.6 0 22.8 10.2 22.8 22.8 c 0 29.2 -40.7 47.4 -40.7 47.4 s -40.7 -17.1 -40.7 -47.4 c 0 -12.6 10.2 -22.8 22.8 -22.8 c 7.2 0 13.7 3.4 17.8 8.6 C 286.8 229.3 293.2 225.9 300.4 225.9 M 300.4 217.9 c -6.5 0 -12.7 2 -17.8 5.7 c -5.1 -3.7 -11.3 -5.7 -17.8 -5.7 c -17 0 -30.8 13.8 -30.8 30.8 c 0 35.3 43.7 54 45.6 54.8 c 1 0.4 2 0.6 3.1 0.6 c 1.1 0 2.2 -0.2 3.3 -0.7 c 1.9 -0.8 45.4 -20.8 45.4 -54.7 C 331.2 231.7 317.4 217.9 300.4 217.9 L 300.4 217.9 z",
        "stroke-width": "2"
      },
      "colour": "#6D0F05"
    },
    {
      "id": "shape_18",
      "tag": "polygon",
      "attrs": {
        "points": "290.1 253.5 290.1 243.1 275.1 243.1 275.1 253.5 264.7 253.5 264.7 268.5 275.1 268.5 275.1 278.9 290.1 278.9 290.1 268.5 300.5 268.5 300.5 253.5",
        "stroke-width": "2"
      },
      "colour": "#FFFFFF"
    }
  ]
}
