{
  "concept": "duck",
  "type": "colouring",
  "viewBox": "0 0 150 150",
  "shapes": [
    {
      "id": "shape_1",
      "tag": "path",
      "attrs": {
        "d": "M69.31,19.83C66.65,15,63.58,6.39,60,5.29c6.17.07,14,3.81,15.56,9,1.91-5.95,7-5.95,10.25-6.17-4.92,4.4-5.25,8.81-5.25,10.8S70.48,22,69.31,19.83Z",
        "stroke-width": "2"
      },
      "colour": "#F1C40F"
    },
    {
      "id": "shape_2",
      "tag": "path",
      "attrs": {
        "d": "M136.24,94.23c0,28.23-35.47,44.1-61.24,44.1s-61.24-15.86-61.24-44.1C13.76,82,22,74,28.35,61,38.11,41,42.27,17.17,75,17.17S111.89,41,121.65,61C128,74,136.24,82,136.24,94.23Z",
        "stroke-width": "2"
      },
      "colour": "#F1C40F"
    },
    {
      "id": "shape_3",
      "tag": "ellipse",
      "attrs": {
        "cx": "52.48",
        "cy": "60.75",
        "rx": "15.94",
        "ry": "10.12",
        "transform": "translate(-16.66 101.53) rotate(-79.71)",
        "stroke-width": "2"
      },
      "colour": "#FFFFFF"
    },
    {
      "id": "shape_4",
      "tag": "ellipse",
      "attrs": {
        "cx": "52.4",
        "cy": "66.69",
        "rx": "6.96",
        "ry": "5.39",
        "transform": "translate(-22.58 106.33) rotate(-79.71)",
        "stroke-width": "2"
      },
      "colour": "#111111"
    },
    {
      "id": "shape_5",
      "tag": "ellipse",
      "attrs": {
        "cx": "97.52",
        "cy": "60.75",
        "rx": "10.12",
        "ry": "15.94",
        "transform": "translate(-9.29 18.4) rotate(-10.29)",
        "stroke-width": "2"
      },
      "colour": "#FFFFFF"
    },
    {
      "id": "shape_6",
      "tag": "ellipse",
      "attrs": {
        "cx": "97.6",
        "cy": "66.69",
        "rx": "5.39",
        "ry": "6.96",
        "transform": "translate(-10.35 18.51) rotate(-10.29)",
        "stroke-width": "2"
      },
      "colour": "#111111"
    },
    {
      "id": "shape_7",
      "tag": "path",
      "attrs": {
        "d": "M118.82,114.66c-8.73,13.53-6.28,29-45.94,29-36.53,0-34.27-15.52-42.32-29-5-8.42-9.87-15.56-5.64-19.27s16.65-.26,25.44-.26,9.92-13.91,22.52-13.91c13.69,0,14.91,13.91,24.45,13.91s22.9-3.54,27.62.26S124.25,106.24,118.82,114.66Z",
        "stroke-width": "2"
      },
      "colour": "#E67E22"
    },
    {
      "id": "shape_8",
      "tag": "path",
      "attrs": {
        "d": "M58.6,105.94c-1.71-3-1.25-5.24.38-6.17s3.8-.19,5.51,2.79,2.31,7.09.68,8S60.31,108.92,58.6,105.94Z",
        "stroke-width": "2",
        "fill": "#000000"
      },
      "noColour": true,
      "fixed": true
    },
    {
      "id": "shape_9",
      "tag": "path",
      "attrs": {
        "d": "M91.4,105.94c1.71-3,1.25-5.24-.38-6.17s-3.8-.19-5.51,2.79-2.31,7.09-.68,8S89.69,108.92,91.4,105.94Z",
        "stroke-width": "2",
        "fill": "#000000"
      },
      "noColour": true,
      "fixed": true
    }
  ]
}
